<?xml version="1.0" encoding="UTF-8"?>
<!-- @snippet-start-with-header component_userguide_10 -->
<componentConfiguration xmlns:xsi="http://www.w3.org/2001/XMLSchema-instance"
    xsi:noNamespaceSchemaLocation="../../../../../../../Core/org/objectweb/proactive/core/component/config/component-config.xsd" 
    name="MyConfigurationName">
    <controllers>
        <controller>
            <interface>
                ControllerInterface
            </interface>
            <implementation>
                ControllerImplementation
            </implementation>
        </controller>
        <!-- other controllers -->
        <!-- @snippet-break component_userguide_10 -->
        <!-- @snippet-start component_userguide_13 -->
        <controller>
            <interface>org.objectweb.proactive.core.component.control.PAInterceptorController</interface>
            <implementation>org.objectweb.proactive.core.component.control.PAInterceptorControllerImpl</implementation>
        </controller>
        <!-- @snippet-end component_userguide_13 -->
        <!-- @snippet-resume component_userguide_10 -->
    </controllers>
</componentConfiguration>
<!-- @snippet-end component_userguide_10 -->